source,product,rating,title,review_text,reviewer,date
google_play,Flipkart,1,,"this app was good until one thing happened, i ordered 2 things at a time paid online. guess what received only one product and the other was missing, the package was ripped slightly so that we couldn't see it. We requested to return the product, we kept in touch with the customer service but after 20 days they said they couldn't do anything about it, and we just got the money of one product. Another product was gone and they took the money too. so bad",Pretha Majumdar,2025-10-19
google_play,Flipkart,3,,"The mobile app is doing something really annoying. You search for something, gets some 1000 items in result, starts exploring, and when you click on the interesting item (some 400th item) to know more about it, it takes you to the dedicated item's page. So far, so good. However, when you return to exploring remaining items in the search result, it starts from the top, instead of going back to 401st item. It just spoils the experience and so many times I have just closed the app, in frustration.",Asma,2025-12-07
google_play,Flipkart,1,,"Worst experience ever! Placed an order during an offer, but the delivery was a nightmare. The agent didn’t answer my calls, and when they finally called once, I missed it—when I called back within a minute, they said they’d already left and I wouldn’t get the product that day. Two days later, they showed up with a damaged product. They took it back, but till now there's no update or acknowledgment on my refund—no idea when I'll get my money back. To make things worse, there’s no customer support",Nishant,2025-10-21
google_play,Flipkart,1,,"Hello, I ordered a water dispenser and it was delivered on August 28. It worked fine until September 7 when the battery died. When I tried charging it with different chargers, it did not charge. When I contacted support, it showed that the 7-day return period had expired. I was unable to contact the seller for assistance or replacement. I was requested to check for repairs in surrounding stores... This was the worst experience I've had thus far. What if the product didn't function aftr7days over",Aathira Lakshmanan,2025-09-15
google_play,Flipkart,1,,"Flipkart app is the WORST amongst all the available online shopping apps. Whenever I try to search something in Grocery, it simply freezes after 1 or 2 searches/inquiries. Many times it also freezes for non-grocery searches as well. And every time the app freezes, I don't see any choice other than to close the app and start the search again. This makes the overall shopping experience really bad.",Sujit Kulkarni,2025-04-13
google_play,Flipkart,2,,The application is user friendly and it is really easy to buy things .. But the problem is while searching the product if u try to search the item more than two times they dont show COD. Any customer will try to search for better products and if the customer searches twice or thrice they immideately block on COD. When I tuk the product it was showing COD option but during billing its not showing COD .. Really sorry to say its really worst experiance any customer will seach for options .,Gayathri Pai,2025-01-01
google_play,Flipkart,1,,"I had a very poor experience with the order. The confirmation said delivery would be within 3 days, but it's been over 2 weeks and I still haven't received the product. I raised a complaint with customer support, but they mentioned issues with the hub and said delivery would take 24-48 hours, which isn't acceptable given the delay.",Suresh Panchapakesan,2026-04-02
google_play,Flipkart,1,,"I am very disappointed with Flipkart's service. I have placed several orders, but they keep getting automatically canceled. Today as well, I ordered a pair of jeans, but by evening, I received a message that it was canceled. Please improve this, as it is a very bad experience, and despite trying multiple times, I still haven't received my items.",Arshad Ali,2026-03-15
google_play,Flipkart,1,,"Nowadays Flipkart’s service has become extremely poor. Deliveries are rescheduled without the customer’s consent, apparently at the convenience of the delivery partner. When contacting customer care, they simply repeat the same information shown in the app and offer no real assistance. Receiving an order on time has become a big struggle. Overall, a very unpleasant customer experience.",livelove JSP,2026-03-15
google_play,Flipkart,1,,"worst experience in my life ever using this app, Dear Customer Support Team, ​I am writing to express my dissatisfaction regarding a return pickup for Order. ​I purchased the product on March 25th and initiated a return request on the same day. Although a pickup was scheduled, the courier failed to arrive on the expected date, and the return request was subsequently cancelled by your system. ​I have since reapplied for the return, yet the pickup has still not occurred.",Sowmiya Loganathan,2026-04-02
google_play,Flipkart,1,,"Extremely disappointed with Flipkart. I prepaid for my order, yet the delivery keeps getting postponed repeatedly without any proper updates. There is no proper customer support to connect with, which makes the situation even more frustrating. This is highly unprofessional and unacceptable after taking full payment. Would not recommend based on this experience.",Shamin Ansari,2026-03-31
google_play,Flipkart,1,,"I was a plus member of this app and used to purchase a lot of products from this app. due to size or quality issues I had to return a lot of products. one day they sent me a torn saree and then when I tried to return the same they just blocked my account. And now I'm unable to login. Also the customer care executives didn't help me unblock my account. I will recommend not to buy anything from Flipkart, instead go to the market and purchase. Plus it's difficult to contact customer care.",Khushboo kapoor,2026-03-30
google_play,Flipkart,1,,"FOR NO REASON, ACCOUNT IS BLOCKED. helpline number was not easily accessible complaints registered are not resolved within the given timeline. Even after Continues follow-up through phone call and emails back to back complaint registration there is no response and the problem is not resolved. The service is very poor and disappointing. I will never suggest flipkart to anyone.",Pavankumar,2026-04-02
google_play,Flipkart,1,,"I am extremely disappointed with Flipkart and its service. This is the fourth time I am facing the same issue. Delivery agents are cancelling orders on their own and marking it as “customer requested cancellation,” which is not true. This is misleading and unacceptable. Customer support is not helpful. They repeat the same scripted lines and do not try to resolve the issue. Even after escalation, they only create a ticket and say that is all they can do. Waste of time. Worst Service.",karumanchi leela naga sandeep,2026-04-01
google_play,Flipkart,1,,"Very misleading pricing! The product shows 86% off at ₹181 on the main page, but when you open it, the discount drops to 62% and price jumps to ₹489. This feels like a bait-and-switch tactic.🤨😐 Extremely disappointing and breaks trust. Please show accurate pricing upfront instead of confusing customers.😒",Bhairav Yogi,2026-04-02
google_play,Flipkart,1,,"Very disappointing experience. I requested a return multiple times, but pickups were repeatedly scheduled and then cancelled without any reason. No delivery agent arrived, and there was no proper communication. I contacted support several times and filed complaints, yet nothing was resolved. My refund request was also cancelled again and again, causing delays and frustration. I am a Flipkart Plus member and a long-time customer, bt after this experience, I'll not use Flipkart again in the future",vishal sharma,2026-04-02
google_play,Flipkart,1,,I had a very bad experience with Flipkart Grocery order where the seller scammed by not delivering one of my products which i ordered and I was not available at that time it was delivered when I return and check the order one of the product was missing and i immediately raised the concern they told we will check and refund but the seller rejected so many times around 15 times and finally saying it's OTP order why the customer has not verified at the time of delivery so we will not refund money.,Karthick Patrose,2026-04-01
google_play,Flipkart,2,,"Flipkart is a very useful app for online shopping with good prices and many product options. Delivery is fast and the service is mostly reliable and easy to use, but it is not good that platform charges are taken on every delivery and not refunded on return or cancellation, so I stopped ordering after feeling this policy is not fair",Durgesh Tiwari,2026-03-20
google_play,Flipkart,1,,"There r so many glitches in the app even after updating to the latest version. Whenever I'm trying to open the UPI option,it repeatedly asks me to update the app, I uninstalled and reinstalled it, but the issue remains. Additionally the expiry date is not visible on any product, even it Minutes section,making it impossible to check freshness before ordering. Lastly, I’m unable to access the delivery tracking option...Pls fix these glitches ASAP.",Nabanita Paul,2026-03-07
google_play,Flipkart,1,,"I am Bala disappointed with Flipkart’s so-called “Express Delivery” service. While placing the order, it clearly showed fast delivery, but in reality, the product was delayed significantly without any proper updates. The biggest issue is with logistics — there seems to be poor coordination, and the tracking information is either inaccurate or not updated on time. This defeats the whole purpose of choosing express delivery. Customer support was equally frustrating. Instead of providing a proper",Bala Koteswararao,2026-03-31
google_play,Flipkart,5,,"It sounds incredibly frustrating to have orders canceled without your consent, especially when you are waiting for a delivery. While I am an AI and don't manage the physical courier or delivery operations directly, I can certainly help you translate your message into English so you can send it to the official customer support team. ​Here is the English translation of your request: ​Subject: Issue with Delivery and Unauthorized Order Cancellations ​""I am writing to report a serious issue with you",Srinanchari Suvarna,2026-03-29
google_play,Flipkart,1,,"I have been using the Flipkart app for quite some time, and in the past, I noticed it had multiple performance and usability issues. However, the current problem is more serious - the app is not opening at all on my Samsung S21 FE device. I have tried restarting my phone, clearing cache, and even reinstalling the app, but the issue persists. This is quite frustrating, as I rely on the app for regular purchases and tracking orders.",NAVDEEP SHARMA,2026-04-01
google_play,Flipkart,1,,worst experience in the last few months ..i placed the order and after some time they rescheduled my delivery date and after long time they cancelled my order . same reason for all my orders . I haven't received any order in a long time ..I pay the money and after 20 days they return but do not deliver any order.,Kumar Singh,2026-03-31
google_play,Flipkart,1,,"Very disappointing experience with Flipkart lately. I was trying to order grocery items, but the app kept restricting me from adding more than one quantity of any product. When I checked the cart, it suddenly showed items as out of stock. This happened with almost every grocery item I tried to order. What’s the point of showing products if they are not actually available? The app has become unreliable and frustrating to use. Please fix these technical issues instead of wasting customers’ time.",Misba Sultana,2026-02-07
google_play,Flipkart,1,,"Hi Dear Flipkart Support Team, I hope you are doing well. I am facing an issue while trying to place an order on your platform. Whenever I attempt to order a product, I receive a message stating that the product is not available for my location. I kindly request you to look into this issue and help resolve it at the earliest, as I am unable to complete my purchase.",Nishchit Shetty,2026-03-31
google_play,Flipkart,1,,"Great product but hidden fees are triple the price ""The Doms color pencils and water colors are excellent for students, but I am extremely disappointed with the hidden charges on Flipkart. While the product is priced at only ₹97, a 'Handling Fee' of ₹129 was added at the final checkout, which is more than the cost of the item itself. This is a very unfair practice, especially for students on a budget. I recommend everyone check their total bill carefully before paying.",Mayuri K,2026-02-22
google_play,Flipkart,1,,"pathetic app service lately. product landing page shows supercoins applied for extra discount, when proceeding to payment asks original price. Anyone not paying attention will just pay extra assuming they got a steal deal. And im a black member btw! switching to amazon for peace of mind. good luck with your games. Not to forget platform fee of 29 vs 5 rs on Amazon only to get the feeling of opening my parcel taken away by flipkart. Improve your game!",Lavanya Baranwal,2026-03-31
google_play,Flipkart,1,,"Very disappointed with the service. After the US tariff, I started using this 100%. But to my disappointment, service has been worse. Problems in returns, prices higher than Amezon, low quality products on display and after sales, a major eye opener. For exclusive products sold on the platform, warranty calim takes 2 months and after replacement a new product fails in less than a month for which no service parts are available and still remains in warranty. Really very sad. Stopped using now.",Milind Karandikar,2026-03-08
google_play,Flipkart,1,,"I recently had a very disappointing experience with Flipkart. I ordered a specific product, but instead, I received a completely different item. This is highly unprofessional and unacceptable. On top of that, the item I received was expired, which is not only careless but also potentially harmful to customers. As a regular online shopper, I trusted Flipkart for its quality service, but this incident has seriously affected my confidence in the platform. Receiving wrong and expired products clear",Aryan Dhuriya,2026-04-03
google_play,Flipkart,1,,"I've been using flipkart for a decade now and I'm also a plus member for so many years. Its new feature flipkart upi is just so irritating, I'm not able to add any other upi. It's so irritating nowadays to order anything because of this new system. Not able to add another number upi as it shows no active upi, why does it have to be the same number's bank account which we are using, who the hell is flipkart to not allow any other upi id or any other method",A Google user,2026-04-01
google_play,Flipkart,1,,"I was trying not write anything negative, but I don't think I can stop myself anymore. This is the worst experience I have had compared to any other online delivery app. At this point it looks like 'they don't even care for their customers?' I ordered a travel bag it was supposed to be delivered by 26th March but it's still not arrived at the hub nearest. I complained about it but still no update. Thanks and I'm done with this and never going to ever use this delivery app service.",Nitish Kumar Gope,2026-03-31
google_play,Flipkart,2,,"Very poor service, Now a days from flipkart and the delivery partnes, 1.Items is not received and it was showing delivered and when I complained about it, the delivery was canceled without my concern. 2.The delivery partners, they will call and say they will come in 30mins, and they will come after 4-5hrs, is this the way they are doing it for past 3months, before it was smooth, now a days it was worst service and time loss.",jetheesh jackson,2026-03-30
google_play,Flipkart,1,,"Hello Flipkart Support Team, I am a regular customer of Flipkart and have been using this account for a long time. Recently, I am facing a serious issue while trying to place orders. Whenever I open the order page, it keeps loading continuously and shows ""Server Busy / Try Again Later"" error. Because of this, I am unable to purchase any products. I have already tried basic troubleshooting steps like reinstalling the app, clearing cache, and using different internet connections, but the issue",Nalaiya தமிழன்,2026-03-30
google_play,Flipkart,2,,"Flipkart is playing with us. I requested a mobile exchange, and they initially quoted ₹3150. But during delivery, after verification, they said they can give only ₹1300, leaving me no option but to pay an extra ₹1850. Also, it has been 4 days, and I still haven’t received my product. Please don’t opt for exchange or book anything on Flipkart.",vinay kumarcs,2026-03-31
google_play,Flipkart,2,,"you should be adding select option to specifically select what items u want to order rn from the bunch added in the cart and place order without removing other items from the cart like amazon one account can be used by multiple ppl, everyone can't be saving others products to wishlist or save for later to order the items they want for themselves",Usha Sree,2026-04-02
google_play,Flipkart,1,,"My experience with Flipkart delivery has been extremely disappointing. Orders are never delivered on time—not just once, but every single time. The delivery date keeps getting extended day by day without any proper explanation. Does customer time have no value? If you can't meet the promised delivery timelines, you should show realistic dates from the start. This kind of unreliable service makes it very hard to trust Flipkart anymore.",Roshan More,2026-03-27
google_play,Flipkart,3,,"They really need improvement in return policy and also in customer care services. Flipkart don't work in favour of customers. Have tendency to block refunds. Return is difficult. And after some returns they start charging fine on return. And many times they didn't refund the full amount. They have tendency to keep money of customers. Totally hopeless return, refund and customer services. Must learn from Amazon. Amazon is so genuine.....",Dr. Neha Jain,2026-04-01
google_play,Flipkart,1,,"I ordered a stove from Flipkart, but had a very bad experience with delivery. The delivery agent called me, and I requested him to wait just 5 minutes as I was on the way. But without waiting or calling back, he marked the order as rejected and returned it. This is completely unprofessional. There is also no proper option to contact the delivery person or Ekart Logistics support, flipkart such situations. Because of this, I lost my order for no valid reason.",Varun,2026-03-28
google_play,Flipkart,3,,"One basic payment feature is missing in this application. In order to make any UPI payments, the UPI application should be installed with same Id on the same device. There is no way that I can enter the UPI id for purchase in any text option where app to verify if it's valid id and then execute transaction. Something very useful when we have the UPI id/ application on some other device and we want to do frequent shopping Also, it would be nice to give option to share cart items on WhatsApp",Apurva Jain,2026-04-03
google_play,Flipkart,1,,"I had ordered a mobile phone and prepaid the amount. After waiting for 5 days the product was ""Out for Delivery"" but never reached me. The delivery agent number was continuously switched off and Customer care people just gave false assurance that the product will reach me on time. Surprisingly the product order got cancelled by Flipkart and Customer support gave idiotic reasons like quantity restrictions by the seller. Worst Experience Ever 😡",MOHAMMED RAFI,2026-03-28
google_play,Flipkart,1,,"I have stopped buying from Flipkart Mintues . They don't provide any carry bags, but that's not the main issue. The real problem is that this is not informed while placing the order. Moreover, the delivery person often doesn't come to the doorstep; instead, they stop at some distance and hand over the items loosely. This is highly inconvenient, disrespectful, and even a threat to privacy. Now I understand why Blinkit is considered better in this area-it never follows such shady practices.",CA Raman Goel,2026-03-27
google_play,Flipkart,1,,I have very bad experience with this shopping aap. they are cancelled my order without my concern. even I have already paid for all products. and delivery service provider asking me for change my pincode. I'm done with this shopping aap now. if you resolve the issue then I will continue. please take action and improve your service. it's a humble request.,Ashwini,2026-03-31
google_play,Flipkart,4,,"I would like to report an issue with the Flipkart mobile app regarding address selection. When I try to set my delivery location in the app, I am unable to manually enter my correct address. The app forces me to choose from suggested locations, and when I select my house location, the automatically generated address shown is inaccurate and does not correctly reflect my actual address. However, this issue does not occur when I use Flipkart through a web browser (Google). On the website, my addr",Mervin V,2026-03-24
google_play,Flipkart,1,,"i have ordered a helmet. and the product received with too many scratches and dents also. and thw issue is i need to replace it with same colour same product. but there is no option for the same product colour. then i dont need that product, i go for return and refund option,, problem is if refund there is cutting of 15 something platform fee. why i pay this for received damaged product. 2nd time it.as a regular customer i never expected this from flipkart team.. very disappointed about this.",Vrone,2026-03-27
google_play,Flipkart,1,,"platform fee and hidden charges are high, even if you cancel order within few minutes, without product being shipped, still platform fees are not returned unlike amazon which do return market place fee upon cancellation. And service of amazon is better, Faster deliver, more reliable. Don't trust this SCAM flipkart, always order on Amazon.",satish raja (!nf!n!ty),2026-03-29
google_play,Flipkart,4,,"Recently I had an issue with the delivery, I received another package instead of what I ordered and the system was having a glitch and it was very difficult to handle it but the customer service was very nice they solved the issue within a week and I received a complete refund of my item. I would like to suggest that whenever you are buying something make sure to check the reviews of that certain product.",sreeja suresh,2026-03-01
google_play,Flipkart,1,,"Flipkart is the worst third-party app. There is no return policy after the order is delivered. flipkart will refuse to take back their product. They will give you the wrong product, and you won't get a refund or the item replaced. If you feel the packaging is wrong, do not give the OTP and do not make an online payment.",Hollywood Dubbed Movies,2026-04-02
google_play,Flipkart,1,,"​I am writing to express my frustration regarding my order placed on . The promised delivery time was 3 days, but even after 12 days, the product has not reached me. ​I have already contacted customer support multiple times, but I haven't received a clear response or a fixed delivery date. This level of service is unacceptable. ​",Rahul Kumar,2026-03-30
google_play,Flipkart,1,,"This is a very poor app...honestly the worst I have ever used... I ordered a phone cover that was listed at ₹169, but at the time of delivery...I was asked to pay ₹277...This is unacceptable... I also found the same cover in the local market for ₹110....I would like to ask Flipkart why there is such a price difference and lack of transparency-",Mahreen Mohsin,2026-03-30
google_play,Flipkart,1,,"App has performance as well as UI issues. On some product page the UI stutters a lot, I have seen this while browsing for Samsung phones (it's not limited to Samsung products only). Stutter is so bad that can't even scroll the page. About UI, on android phones the navigation bar at the bottom shows black background if system is set to dark mode, looks very ugly as app follows light mode. Someone needs to fix this basic UI issue, Amazon app handles it very well.",Swapnil Somkuwar,2026-04-01
google_play,Flipkart,1,,Very bad experience as they are not showing the goods and transport charges while buying the product. They are purposefully hiding the goods and transport charges in the name of selling price. All other platforms showing it fair and square here they are clubbing it with MRP and disguising the customers in the name of selling price. All the products you are buying now is more than the mrp and with high amounts of transportation fee. please be very careful of this cheating trick they are using.,lakshmi priyanka,2026-04-03
google_play,Flipkart,4,,"I kindly request the developers of Flipkart to address an issue in the Flipkart app. The main problem occurs in the wishlist section. When we open a specific item from the wishlist and then go back, the page scrolls all the way to the top instead of returning to the previous position. This is very frustrating for users, especially when browsing many items. I have already reported this issue multiple times, but it has not yet been resolved. Additionally, the Flipkart app is experiencing signific",HARSHA VARDHAN ALURU,2026-03-29
