source,product,rating,title,review_text,reviewer,date
google_play,Myntra,3,,"Everything is good but the problem is when I order something, then I am given a scratch card in which we can a get a certain amount of Myncash for our next order. But what is happening is whenever I scratch that card , it shows me "" Better Luck, next time"". I have ordered many things but it always shows this and do not give me any Myncash. How much my luck can be better? is it as that worst. Maybe there is some issue in scratch cards.",Manasvi Prajapati,2025-09-03
google_play,Myntra,1,,"As a first time user, my experience with the product and delivery agent was too poor. They delivered the product too late and that too was defected. Had a call with their customer care on the next day and after that they picked up the defected product and never updated in their system and resend me the same product after using some glue. I raised a concern again but they never bothered to replace it or exchange it with another product. After chasing them for 2 weeks nothing happened.",Ashish Sharma,2026-04-03
google_play,Myntra,3,,"don't know why the app is not working properly... evrything is good about delivery experience, product quality and return policy but instead of high speed data app takes too much time to open then after this loading other things that may be the interface or any kind of product it don't show any image while written things are shown..... I can't able to use it properly, experiencing for over a months continuously and I order from website if I want.",Apeksha Chaudhary,2026-04-03
google_play,Myntra,1,,"I had a very disappointing experience with myntra. Their return policy is unfair and misleading. Every time you return an item, they deduct ₹50. It makes the whole process frustrating, especially when the product quality or sizing doesn’t match expectations. Policies like this make the brand come across as more interested in squeezing extra money out of customers than actually providing good service. I won't be shopping from here again. Highly disappointed.",Tanvi Garg,2026-03-07
google_play,Myntra,1,,"I am writing to express my disappointment with my recent experience. I had ordered two items from your platform, and after waiting for almost a week, both orders were automatically cancelled at the last moment without any prior notice or clear explanation. This situation was extremely frustrating, as I had been waiting for the delivery and trusted your service. To make matters worse, when I contacted customer care for assistance, I did not receive any proper",Harsh Yadav,2026-03-19
google_play,Myntra,1,,"I have ordered one product, however, the quality does not meet expectations. product does not match the color shown in the images, and there is no option available for color exchange(havn't mentioned in the product).size changes is available with no return. I kindly request you to look into this matter. I have already contacted customer support but have not received a satisfactory response. Very bad experience i have with this, don't get support for this. Support person cut my call in between.",Anubha Agrawal,2026-03-23
google_play,Myntra,1,,Bogus app they don't resolve your complaints. They say they have raised a ticket to resolve an issue of undelivered product which was marked as delivered but they close the issue without communicating properly. I have been following up with them for the past two weeks for the same issue and their customer service agents just leave the chat midway. if you connect with them on call and ask them to forward the call to their senior all they do is ask you to wait and then disconnect the call.,Anusuya Mudaliar,2026-03-15
google_play,Myntra,3,,"I had a terrible experience with Myntra. I ordered a tracksuit but it was too big, so I placed an exchange and ordered shoes instead. When the delivery agent came, he suddenly claimed there were “marks” on the tracksuit, which is ridiculous because it was never worn or tried on. We only took it out once, looked at the size, and put it back in the plastic. Still, he refused the exchange. Support was useless too the “Call Me Now” option never worked. Not gonna buy much from now on...🙏","Madhumita,Siddhiksha Sharma",2026-03-16
google_play,Myntra,1,,"Received a saree without a tag, and now my return request is being rejected. This is not my mistake, as the product was delivered in this condition. Very disappointed with the service. Compared to other platforms like Flipkart, Amazon, and Meesho, where customer support responds quickly and resolves issues, Myntra’s response has been very poor. No proper support or timely help, which is really frustrating. Kindly look into this issue and resolve it as soon as possible.",Muddaboina Jyothi,2026-03-25
google_play,Myntra,1,,"""I have ordered one product, however, the quality does not meet expectations. product does not match the color shown in the images, and there is no option available for color exchange (haven't mentioned in the product). size changes is available with no return. I kindly request you to look into this matter. I have already contacted customer support but have not received a satisfactory response. Very bad experience i have with this, don't get support for this.",Laxmi Prajapat,2026-03-30
google_play,Myntra,1,,"Myntra was an extremely poor experience. I've had problems with my orders on several occasions. This time, my order was cancelled without an appropriate reason after six days. An order I placed earlier was marked delivered, yet it took me four days to actually get it. In addition, the sneakers I purchased were damaged in less than a month. Unreliable delivery and poor service.",Bhumika Rohilla,2026-03-22
google_play,Myntra,5,,"​Myntra has completely changed the way I shop for clothes and beauty products. The app interface is incredibly smooth—I love the new Liquid Glass design; it makes browsing feel so much faster. The variety of brands is unmatched, and I always find exactly what I’m looking for, whether it’s trendy ethnic wear or the latest sneakers. ​The Insider Loyalty Program is a huge plus, and I love getting early access to sales. Delivery is always on time, and the tracking feature is very reliable.",Neha Rode,2026-03-31
google_play,Myntra,1,,"My order was accepted without any issue, but later marked as “delivery failed” without any attempt, and no new delivery date was shown. Support asked me to wait, then closed the ticket with a generic response saying the pincode is unserviceable and asked me to place a new order. If the pincode was not serviceable, why was the order accepted? Now I will lose my discount and MynCash if I reorder. Very poor system and inconsistent handling.",Meet Patel,2026-03-29
google_play,Myntra,1,,"I have purchased many things from Myntra in the past, but the quality has hit rock bottom. My latest order contained shoes that were damaged and looked used. It is unacceptable to pay full price for second-hand goods. I am losing trust in this platform. Extremely worst experience. Better to shop elsewhere.",Abhay Yadav,2026-03-30
google_play,Myntra,1,,"I had a very bad experience with Myntra. Two of my orders were cancelled in a row, and they didn’t even provide any reason for the cancellations. When I tried to contact the help center, there was no proper support available to address my questions or concerns. There is no proper way to communicate with customer service. This is very disappointing.",Shilpa Mehta,2026-04-02
google_play,Myntra,3,,"The deliveries are going well, but when it comes to exchanging or returning a product, it takes a lot of time. I also wanted to exchange it. I have been calling customer care since the same day, but unfortunately I have not received any response from there. Every time they postpone the issue by giving a 24-hour deadline. This has been happening for the last 14 days.",Malik Tabi,2026-04-03
google_play,Myntra,1,,"I am extremely disappointed with my recent online shopping experience. Despite submitting several complaints, I have received no response. As an elite member, I find this level of service unacceptable and not in line with how customers should be treated. Sending wrong product and not even responding to complaints. wanted to give minus star if that was possible.",Honnah Bantawa,2026-04-03
google_play,Myntra,5,,"I recently had a wonderful shopping experience with Myntra, and I feel genuinely happy to share my appreciation for the platform. From the moment I opened the app, everything felt smooth, user-friendly, and well-organized. The interface is clean and easy to navigate, making it simple to browse through a wide range of products without any confusion. Whether it’s clothing, footwear, or accessories, Myntra offers an impressive collection that suits different styles, preferences, and budgets.",Praveen Raja,2026-04-04
google_play,Myntra,1,,I wish there was an option to give 0 Stars. If you don't get your refund for returned items within 24 hours then just forget that money. no one will listen they will just say everyday that wait 24 hours your query will be resolved and then nothing happens. My refund is on hold for a week and app shows that refund credited. If you have extra money to give someone and forget it for a month then go ahead and shop with myntra but don't expect any customer care service. They only charge 23 rs.,Harshita Rai,2026-04-03
google_play,Myntra,1,,"This is one of the worst e-commerce platforms I have ever used. They cancelled my order, delayed my replacement, and I have been trying to contact them since my first order, but I never got connected. Every time I tried, the call got disconnected automatically.",Vishawa Bhushan Ojha,2026-04-01
google_play,Myntra,3,,"app is very good and also delivery experience is good but the only thing which is very wrong is the high platform fee like no matter how big is your order , there is a constant platform fee of rupee 23 . I'm not against the platform fee but ₹23 is a little high please if possible reduce it to ₹11 or if not then remove it in big orders like above 500 rupees.",saksham jaiswal,2026-03-25
google_play,Myntra,1,,"very worst customer service, very slow delivery , they mentioned exchange and return but delivery agent not coming back to recieve the product. Myntra is running an online fraud. I have escalated the issue multiple times and every time they asked me to wait 2-3 business days for an update. For the last one month, I have been waiting for my order to be delivered. Ironically, the have products listed on the app but in reality they do not have the product. So they take money from the customers",Bright Bala,2026-03-13
google_play,Myntra,5,,"THIS IS AMAZING APP recently ordered a few items from Myntra and I am quite satisfied with the experience. The product quality is excellent and exactly as shown in the pictures. Delivery was prompt, and the packaging was secure. The app is easy to navigate, and the wide range of brands makes it my go-to fashion destination. Highly recommended!"" have been shopping on Myntra for quite some time now, and it has become my go-to app for fashion. The variety of brands is amazing, and I absolutely lov",ANAM MALIK,2026-03-13
google_play,Myntra,1,,I have a unpleasant and frustrating experience. I made a prepaid order after few days order shows Out for delivery and then it shows undelivered we will re attempt. after making usnto wait for 3 days order gets cancelled without reason. It feels like it is a scam they don't have product but still take orders and then cancel it just to show how many people are ordering from Myntra I raised many complaints not even once I got a call or customer support. Kindly call me and resolve the issue.,imran pasha,2026-03-16
google_play,Myntra,2,,"I had a really bad experience with Myntra. My order was marked as delivered, but I never actually received it. When I contacted customer support, they didn’t provide any proper resolution and kept asking me to wait. It feels very frustrating and unreliable. I expected better service, but this was completely disappointing.",SHWETA SINGH,2026-03-20
google_play,Myntra,1,,"Every time I place an order, the amount gets debited, the order reaches my city and on the day of delivery, they cancel those orders. It's a scam run by myntra team that grabs the platform fee and never refunds that amount. They fool their customers. Flipkart is far better than myntra, as they warn their customers that pincode is not serviceable, myntra doesn't. They cancel after reaching the city. Fraud app.",chetna rathore,2026-03-28
google_play,Myntra,1,,"This has been the worst shopping experience I’ve ever had. The app keeps cancelling my order on the delivery date itself. This has happened almost 5 times now. It’s extremely frustrating to wait for something and then have it cancelled at the last moment without proper explanation. If you can’t deliver the product, don’t confirm the order in the first place. This kind of service is completely unreliable and a waste of time. Very disappointed.",Shreya Chavan,2026-03-04
google_play,Myntra,5,,"best app for shopping, unbelievable discount, quality products, wide range to choose, easy to find similar products, insider got extra benefits and many more. just love this app 😍 ❤️ . guys just go for it if you want satisfaction and fun shopping. it has never disappoint me. it is a trusted platform to buy clothes, beauty products and unique kind of jewelry. believe me you will get amazing discount on branded items",Kiranjit Kaur,2026-03-10
google_play,Myntra,1,,"Myntra is so good in terms of app experience, variety, discounts, return policy etc. But main reason i avoid buying from it is delay in delivery. I don't know why order remain in confirmed state for 2-3 days and shipped with such delay. Websites like amazon are delivering same product in 1-2 day.",S,2026-03-30
google_play,Myntra,1,,"Unethical and highly disappointing. I ordered two items, but only one arrived. Despite this, Myntra marked the entire order as ""Delivered."" This is a complete delivery scam—claiming full delivery when half the items are missing. Very misleading and frustrating. Never ordering again!",Pooja Kishore,2026-03-30
google_play,Myntra,1,,The worst shopping app creates problems for customers firstly they delivered the wrong product and then they cancelled exchange despite confirming the exchange and the reason is unknown they take time and keep you waited and once the exchange window is closed they cancelled the exchange so you have no option left but to keep the wrong product please don't order from myntra.,maryam,2026-04-01
google_play,Myntra,5,,"Great app for fashion shopping. Huge variety of brands, good discounts during sales, and fast delivery. The interface is easy to use and product quality is mostly good. Returns and exchanges are also simple. Overall a very good shopping experience.”",Shweta Bade,2026-03-28
google_play,Myntra,5,,"I had a great shopping experience with the Myntra app. The app is very user-friendly and easy to navigate. It offers a wide range of fashion products with good quality and reasonable prices. The delivery was quick and the packaging was neat and secure. The product I received was exactly as shown in the pictures and the size fit perfectly. Overall, I am very satisfied with my purchase and would definitely recommend Myntra to others for online fashion shopping.",sampath bogari,2026-03-10
google_play,Myntra,1,,I hate that you do not have a customer care number to speak ..No one is reachable..Chat & Ivr is not good .. Not happy that there is no contact point.. Also why charge us returns when you do not sell good quality products .. You charge so much for product and it's a thorough waste when we get it. Return is inevitable .. we charge you 100 rs everytime you send a bad product and waste our time.,Kajal Bhandari,2026-04-03
google_play,Myntra,2,,"I am extremely disappointed with this experience. I did not receive my order, yet it was marked as “delivered.” It appears that the delivery boy has kept the product himself instead of delivering it to me. This is completely unacceptable and raises serious concerns about the service and trust. I request an immediate investigation into this matter and a full refund or re-delivery of my order as soon as possible. Kindly take strict action and ensure such incidents do not happen again.",A Google user,2026-04-01
google_play,Myntra,1,,Totally pathetic service and app. I have ordered an item which was sent wrong multiple times. on the app there is no option to write and describe the issue it has the basic option to choose from. the customer service centre should be named as a scam service centre they never do what they say on call . you need to keep on calling them every one will assure you issue will be resolved but none of them actually do what they confirm. they disconnect you call or transfer without saying,Misha's World,2026-02-25
google_play,Myntra,5,,"❤️ Love the shopping experience! ""I’ve been using Myntra for a long time now, and it never disappoints. The app interface is very smooth, and the collection of brands is huge. Delivery is always on time, and the packaging is great. Highly recommended for fashion lovers!""🤑🥰🥰",ʜɪᴛᴜ ʀᴀᴛʜᴏʀᴇ,2026-04-03
google_play,Myntra,5,,"“I’ve been using the Myntra app for a long time and my experience has been really good. The app interface is clean and very easy to navigate, which makes browsing and finding products simple. There is a huge variety of fashion brands and styles available, and the discounts during sales are very attractive. Delivery is usually on time and the packaging is neat and secure. I also like how smooth the return and exchange process is, which makes online shopping stress-free.",Naman Jain,2026-03-14
google_play,Myntra,1,,"I've been using the app for a while now and I’m extremely disappointed with the service. My order arrived with a missing product, and the customer support is doing absolutely nothing to help. Every time I contact them, they close the ticket without a resolution.",Muskan Bhatt,2026-03-31
google_play,PhonePe,4,,"I have been using PhonePe for many years, and I really appreciate how easy it is to use. However, I would like to request the addition of a ""filter by exact UPI bank account/credit card"" option in the instruments category. This feature would allow us to track our spending by specific UPI bank accounts or credit cards. Currently, all UPI bank accounts and credit cards are shown together, making it difficult to see how much we have spent from a particular account. Please add this feature asap.",Nagendra Krishna,2026-03-31
google_play,PhonePe,1,,I know I'm not the first person to give this feedback but the new UI is a disaster. I don't know what you did in the background and if it was a tech stack upgrade but it spoiled everything. Using the app without the dark mode is the most unpleasant experience. The previous version itself was amazing and we all got used to it very well. As a user I don't see a need for a new UI. You have tried to fix something that was not broken. Please bring back the old UI.,Balasubramanian S,2025-03-19
google_play,PhonePe,5,,"Thank you team for developing a wonderful app!. it makes money spending easy. I want to request you to add a 'Total amount column' in the bottom of ""History"" and should work for all filters. e.g. monthly wise total amount spent and category wise total amount spent. etc. It will help the people to understand the spending and estimate the monthly budget. Thanks",Santhosh A,2026-04-02
google_play,PhonePe,2,,"I am not satisfied with the support provided. It is very difficult to reach a real person, as all interactions are handled by bots with no option to speak directly to a representative. I applied for the Wish Card, but the application shows a name mismatch issue and cannot be canceled. It has been more than a week, and the issue is still unresolved. I have tried contacting PhonePe through both calls and chat, but it always connects to a bot, with no option to address this specific problem. I have",jagadesh kumar,2026-03-17
google_play,PhonePe,1,,I applied for the phone pe sbi credit card but rejected. I want to know the exact reason but the app said this card is not available for you. whynot available? If not available then why you get all the details and at the end says not available for you and asking me to take a look for phone pe wish credit card whihc you will get only after fixed deposit. If you can't provide the card then why are a you showing up. I have good credit score and excellent payment history. Bad experience.,Aashik Roy,2026-04-03
google_play,PhonePe,1,,"My PhonePe account has been marked as “risky,” and because of this, others are unable to send me money. When they try to pay through PhonePe, it shows that my number is “fraudulent,” even when I provide a different UPI ID. This is causing serious inconvenience and confusion. I have not received any clear explanation about why this is happening. I request the team to please review my account and let me know the exact reason, and resolve this issue as soon as possible.",adarsh bandaru,2026-03-23
google_play,PhonePe,1,,"This is a completely useless app. I missed my exam today just because I did not carried change money and was dependent on it. at last moment PhonePe did not allow me to make payment to the merchant nor add money to UPI lite. The reason was their so called PhonePe protection. Even after having 3 accounts, I could not make payment from even one. In the name of customer support, they only make automated calls, select from that in which there is no option to address the real problem.",Rajesh Kumar jha,2026-03-17
google_play,PhonePe,1,,My account was automatically logged out yesterday. I have been trying to log in again since then. But there is a pop up message saying Unable to proceed. We are currently facing a technical issue. Please try again later. It has almost been 26 hrs and it shows the same pop up message every time I try to log in.,Deepak Kumar Sinha,2026-04-02
google_play,PhonePe,1,,"worst customer support. I raised a concern on ticket and they can't check ongoing offer and internally or ongoing public offer. each time they will ask proof and attach screenshot. after that they will and in each call they can't see ticket description and will ask from you and will put on hold for 10-15 minutes. not sure, will they have access of tickets or not but it's a serious concern where you frustrate the customer and not solving the issue after few days.",praveen kullharee,2026-03-31
google_play,PhonePe,4,,"PhonePe is a very useful and reliable app for digital payments. It makes transactions quick and easy, whether for mobile recharges, bill payments, or money transfers. The interface is simple and user‑friendly, and security features give confidence while using it. I gave 4 stars because sometimes the app takes extra time to load or certain offers are limited, but overall it’s a trustworthy and convenient platform for everyday payments",Sanjay rawal,2026-03-30
google_play,PhonePe,1,,Extremely stressful experience selling gold in phonepe. I didn't receive payment in my account even after 48 hours.Raised ticket but no response and very worst customer support that you can't reach for any emergency.A payment app must ensure reliability when handling large amounts. Users should not have to worry whether their money is safe.This situation creates panic when hard earned money is involved. I was using the app for a very long time and now definitely need to rethink using it again.,NagaPriya S,2026-04-02
google_play,PhonePe,5,,I use credit card only in case of emergency. I was able to add money to wallet using credit card conveniently with all the necessary verification. Last time I used credit card was couple of years ago in another app. This time I took credit using phone pay. Thank You. Best Regards giri,Girish Devappa,2026-03-30
google_play,PhonePe,2,,Even if you're using Phonepee credit card in the phonepee application platform and convenience is applicable for all utilities and Insurance payment. this fee is quite High compared to other platform credit cards. Rupay variant is not available on SBI phonepee black credit card. I received a VISA variant so I can't use it for UPI Transaction thru phonepe application.,Logesh Kumar,2026-03-30
google_play,PhonePe,1,,"Very disappointing experience with PhonePe. The app works fine until there is a problem. Once you get stuck, there is no proper way to speak to customer support or get the email. Even after writing to wallmart, could not get email. The available options are limited and unhelpful. I received no proper resolution. Out of frustration, I had to use the balance for mobile recharge just to clear the funds. very pathetic experi.",M Sharma,2026-03-04
google_play,PhonePe,2,,I started doing daily savings of rupees 10 and due to some reasons I logged out of phonepe and when I logged back in after few months my money was getting deducted i have proof of it in my yono transaction history but I'm not able to see it plus I'm not even able to pause I tried reaching help center no response I tried calling no response I want to pause the autopay I checked under autopay section of phonepe nothing was there yet money is getting deducted i want this matter resolved .,Puzzlement,2026-03-31
