source,product,rating,title,review_text,reviewer,date
google_play,Amazon Shopping,1,,"Your delivery agents are very poor. Even after showing “Out for Delivery,” they do not deliver the item. I will not shop from Amazon anymore, and I will also suggest others not to shop from there. We place orders with high expectations that the item will be delivered on the promised date, but instead, the order gets canceled on the same day—even after showing the “Out for Delivery” status.",mohd sabauddin,2026-03-17
google_play,Amazon Shopping,2,,2-25 update I used to love this app but half of my next day things don't arrive for 2-3 days (if then) and they can't blame COVID now. I add things into those orders and then the thing I need most doesn't arrive ?? Love the app and I use it daily! It would be nice if when you favorite an item it would give you a drop down menu to put it in the list you want. I like that it shows items you've purchased when you are browsing. I'd like it if the order history showed farther back like it used to .,Kate W,2026-02-15
google_play,Amazon Shopping,2,,"Very deceptive with their delivery dates. I understand that unforeseen interruptions happen, but I am consistently ""promised"" a delivery date, only to have it changed with zero explanation or even a notification. I make plans based on Amazon's ""promise"" but they can't be trusted. I have screenshots to back up my review of this terrible business model.",Nate Tobin,2026-03-07
google_play,Amazon Shopping,3,,"This app has not been compatible with all of the AI return questions that are needed to continue during returns. The font sizes are also not the right size to see words at the bottom of certain screens (like when the bottom bar pops up when adding/removing a product to/from list on a product page). I haven't enlarged my font, so I shouldn't need to change my system-wide font sizes to smaller than default to make apps viewable.",Steven W. (id6klub),2026-02-14
google_play,Amazon Shopping,5,,"Amazon shopping batabase at your finger-tips, I have used this app on multiple occations. it is so easy to search products, buy them or save them for later. Also i can view my entire purchase history, re-purchase products. that you have brought before. I can Review products and give ""feebdack"" and arange for a return if no longer needed.",John Swiestowski,2026-02-26
google_play,Amazon Shopping,3,,It is okay. The app is easy to use and the service is okay. I just wish you could learn the origin of the manufacturer and where the products are shipping from without having to do a ton of research from off of the app... what is even more sad is that when it is suggested or desired Amazon does everything they can to shut that option down. they almost messed up and gave it to us when they were trying to show us tariffs into the US but quickly realized that many people wanted that info.,John Davoust,2026-02-12
google_play,Amazon Shopping,5,,"Really easy to use, and there's a fantastic choice of products. You can pretty much always find a bargain, whatever you're looking for. Delivery is usually very quick and reliable, and the no quibble returns process is brilliant. I don't have transport, so Amazon is a real lifeline for me, and I use it pretty much daily!",Jon-Paule Ambrose,2026-02-18
google_play,Amazon Shopping,3,,"3 stars as I am having issues with amazon today. It was working fine yesterday, but when I've gone to check on my order status this morning, all of my amazon orders have disappeared except anything that is associated with Amazon Video, or Audible. I have already cleared cache and data ad well as uninstalling and reinstallimg the app but having no luck. The issue is also happening on the desktop site as well. Please fix.",Alexandra Catherine Hall,2026-02-27
google_play,Amazon Shopping,1,,Amazon has become un-human when it comes to customer service. I can't uncheck using my digital Amazon gift card as payment of prime membership. I was saving that for something else. Amazon is about to lose me as a customer since I can't talk to an actual person about this! They don't give out numbers no more to call to resolve things. I hate that you have to choose the very limited options about your complaint.,James Jones,2026-02-18
google_play,Amazon Shopping,1,,"DON'T BOTHER WITH THE APP, OR THE WEBSITE...UD#4 NOW WHAT HAVE THEY DONE TO AMAZON??Who can we contact about website design issues?? n/m NOBODY,THEY DON'T CARE. Search results show ""not available"" AND no prices??!!This disaster will be the last straw! I am so done with Amazon-if this isn't fixed I'm canceling my account. For character count I had to remove several review updates that show the steady decline over time. Years ago this app used to be great. :( :( :( PS thanks for offering help. Not",Linda Sue,2026-03-06
google_play,Amazon Shopping,1,,"Ordering works great, but if you have to manage any settings in the app regarding order history, subscriptions or any personal information, it is an absolute nightmare. You have to click yourself through 10 different menus, to find out, the in the help mentioned menu does not exist anymore.",Gary Kries,2026-01-09
google_play,Amazon Shopping,1,,"App is currently broken for payment currently. >:( I've been having recent issues with my payment despite it being flawless less than 2 weeks ago. It keeps saying my card is expired despite it being good for another 2 years at least. I'd blame the latest update when AWS went down, as that's when this absolute malarkey has started. I've contacted Amazon tech support directly, it looks good for maybe a few minutes when they fix it, and then boom, card is expired except it isn't. Fix this Amazon.",Jake P,2025-10-29
google_play,Amazon Shopping,1,,"Not for tablets anymore?!! I've been using this app for years on my tablets, and it started glitching and locking up frequently, so I thought I'll uninstall it and reinstall it. I can't reinstall it. Google play says it's not compatible with tablets now and offers no other app in its place. why??! Now I'm stuck with the online website shopping experience, which is terrible! Customer service was a dead end. This will deter me from shopping on Amazon and may force me to cancel prime.",Joanne,2026-02-26
google_play,Amazon Shopping,2,,"Put Rufus where I'm constantly clicking it. I'm constantly getting issues where it won't load the picture. Constantly having items damaged or just never get shipped this having to wait weeks for a refund. Probably 1 in 5 packages. **Read the comments people. Sellers are allowed to change the item for sale, keeping the comments/score Rather than just having to create a new ad for a new item. A lot of times the five-star review is for a completely different item. Amazon should not allow that.",Meaghan R,2024-11-25
google_play,Amazon Shopping,1,,"Can't access our orders for tracking anymore since the recent change. I do a search for my orders and it shows me shipping suggestions. I used to use the app primarily for keeping track of my orders because the web site makes it difficult to tell what's arriving on a particular day and the app used to sort them by the day expected. This was easy, user friendly, and wonderful. Now it's gone. I have no reason to use the app anymore. I can't easily track any packages anymore.",Moraenil,2025-03-09
google_play,Amazon Shopping,1,,"Terrible search algorithm: The app is almost unusable. I have tried and tried to use this site but as the years pass, the search becomes less and less capable. Even 15 years ago I could still use the filters as such. When I searched for an item today, the display photos were massive. Only one item is shown on the screen now. Not only can I not find the correct items, the wrong items take up the whole screen. My eyesight has not changed, nor has my ability to spell or know what I want to buy.",Brea,2025-03-06
google_play,Amazon Shopping,2,,"Look, Amazon is Amazon and it's app isn't all that different from it's website from a mobile standpoint. But now they're putting ads into your notification bar. They could section off ""deals picked for you"" notifs and ""delivery update"" notifs, but they don't. Lumping these two kinds of notifications together without an option to toggle them is ignorant at best and manipulative at worst. I just need quick delivery updates, nothing else, and I don't need an app that can't or won't do just that.",Robert Cooper,2025-02-18
google_play,Amazon Shopping,1,,"The Amazon app can be frustrating, especially during Prime Day and Black Friday, where pricing feels deceptive. Items are often marked up before being “discounted” making it seem like you’re getting a deal when you’re not. Cancelling Prime if you don't want it anymore is a hassle and customer support can be hit or miss. If you have an issue with an order sometimes you get the runaround or are told you’ve been refunded, only to find out you haven't forcing you to go through the process again.",Eric Wilson,2024-12-26
google_play,Amazon Shopping,1,,"Amazon has refused to address problems I first brought up years ago, and now they seem to WANT to be impossible to use. Between facing a disabled ""continue"" button at the payment options screen when paying with gift cards, not being able to buy Amazon gift cards anymore, having Visa cards repeatedly declined without explanation, and useless customer service, I've had my last straw. They've lost me as a customer and I'm deleting my account. This slow, janky app with no offline isn't any better.",Nastka Vegas,2024-09-03
google_play,Amazon Shopping,1,,"This new update is a disaster. Nothing in my wishlist is in order, and there's no way to filter it for most recent items. Search brings up items totally unrelated to the keywords. Not to mention that nearly all orders that have been transferred to USPS disappear and get lost. I live a few miles from a distribution center. There's no reason to transfer them to the post office. Been a member for over 10 years. Disappointed with how things have turned out these last few years.",Roshann Al-Turk,2025-01-11
google_play,Amazon Shopping,1,,"You have to click through like 5 different pages before you have the option to even speak to customer service. Nothing qualifies for return/replacement or refund. What's worse, Amazon moderates all the reviews, so you can't even warn others about anything. UPDATE: they've incorporated that stupid AI assistant bs, which will pop up with ""suggested questions"" every time you click on an item. And 80% of the time, it refuses to go away, making a part of your screen unusable. Utterly infuriating.",Rachel Goldwater,2024-12-04
google_play,Amazon Shopping,1,,"Until today, I have never had any problems with the app. However, today I can't choose options on an item. For example I select an item that can come in different colors. While the button is there showing the current color and a down arrow to select another, tapping it does nothing. I had no problems yesterday, and it just started today. I checked for updates, and I updated. I cleared cache. I force stopped the app. Nothing has corrected the issue. If it corrects itself, I will edit this review.",Christy Macgregor,2024-12-06
google_play,Amazon Shopping,3,,"I've been using this app for years and it's solid, but if there's an issue with your order, Amazon is real persnickety and bull-headed about issuing a refund. Suddenly because the item wasn't ""sold AND shipped"" by Amazon, you the customer have to wait 48 hours or until the seller contacts you about a resolution. Even if you don't want the item anymore, they'll tell you to ""contact the seller"" and make it a spectacle that they can keep themselves out of unless the seller escalates the issue.",Leon M. Burroughs,2024-12-01
google_play,Amazon Shopping,2,,"Has a lot of options, some cheap, others price gouged and clearly coming from drop shippers. They also recently got rid of the ability to organize your lists by moving the items around to be in the order you want them to be, and this was never available to mobile in the first place for some reason. Enshittification hitting Amazon hard.",Micah Brown,2024-11-26
google_play,Amazon Shopping,1,,"The price for a prime membership has not went down, but the service received has decreased significantly! No longer is 2 day prime shipping available. I'm lucky if things show up within a week or more. The price of everything seems skewed, they put a ""sale"" on but it seems the price was jacked up beforehand, and the sale price is just the regular price. Why you wouldn't want to keep your loyal, paying customers happy is beyond me. Prime video, and amazon Alexa both have major issues, too.",Kimberly MGB,2024-12-04
google_play,Amazon Shopping,1,,"UPDATE: 2.5 years later, still not fixed! The one thing I need from this app is not working: I cannot get auditory/vibrating push notifications no matter what I do, only silent alerts. Since Amazon couriers never ring my doorbell, I wouldn't know if a package was delivered unless this app informed me, and I simply don't notice the quiet alerts. (BTW I have no problems enabling sound/vibration alerts with other apps, just this one.) Please, please, Amazon Shopping developers, fix this app.",D D,2026-01-10
google_play,Amazon Shopping,1,,Getting really sick and tired of paying for same day shipping or expecting an order by a certain date and then I'm told AFTER the order is already late that it will be late. Amazon is NOT reliable. I'm about to cancel my subscription and go back to in store shopping. Ridiculous. Please keep taking my money and not holding up your end. Infuriating.,Amber Wagner,2024-10-03
google_play,Amazon Shopping,2,,"The last two months, Amazon has been messing up orders left & right. Not sure what's going on, but they owe me some money for sending incorrect items in multiple orders. App design makes customer service on these issues ridiculously hard to find. All dealings with specific orders should be available on the same page for orders/reviews. It was a great shopping app until May 2025.",Lee Ross,2025-06-10
google_play,Amazon Shopping,1,,"Every time I use this app, it strays further into a buggy mess. Every new ""feature"" is an annoying intrusion on what should be a simple experience. I used to advocate for Amazon's easy returns, quick delivery, and cheaper prices. Unfortunately that is no longer the case. Deliveries are regularly later than stated, and most things are now no longer cheaper than elsewhere, in fact often more expensive. Not to mention the flood of low quality products when you search. But the app... bug after bug.",Des Kelly,2025-06-28
google_play,Amazon Shopping,1,,"Great. Amazon is live in South Africa, but where is the benefit? They practically offer the same products as Takealot at the same or even higher price. I would like to order items typically found in the US and EU. That was really what would have set them apart, giving us access to better quality products, that Takealot simply can not do. As things stand, I have no use for this app whatsoever.",Rynhardt,2024-11-08
google_play,Amazon Shopping,1,,"Don’t buy books from Amazon Australia, it’s been a really poor experience. I’ve had books on backorder for months now. The titles are from a US publisher, and while they keep showing up as “in stock” for US customers with immediate shipping, overseas orders like mine remain on indefinite backorder. It really feels like Amazon is capitalising on new sales over honouring existing orders. They said to cancel my order & reorder it at the higher price so I can get it sooner...",Corey,2025-10-13
google_play,Amazon Shopping,1,,Disappointing considering Amazon doesn't deliver on time. Not sure I will be using this going forward because I'm tired of consistently paying for 2-day delivery and not getting two day delivery when Amazon is the one doing the delivering. an improvement for the app would be to allow us to search by a specific amount of star reviews. Like only searching for 4.5 star review items or 5 star items.,Batya Grace,2025-10-13
google_play,Amazon Shopping,4,,"I seem to be able to find almost everything that I ever look to acquire on either Amazon or Walmart, but more often than not I can find things on both apps, and there has been a very distinct difference in quality and prices when doing comparisons, but it's the time between purchase & delivery that is most often the deciding factor. And as a Prime member I can quite often get my purchases delivered faster with Amazon than Walmart.",TJ Kirby (TJ),2025-10-10
google_play,Amazon Shopping,1,,only this app appears half the screen has a dark overlay tint. Reinstall fixed app. delivery date changes after you order it. Make sure you order 1 month ahead of a holiday or event. Price goes up at 1 mo bef Halloween. Subscription is supposed to be a better deal. there's an extra fee that makes it cost more than 1x buy. The $ bounces on some products so much that a sub at least $ locks in. Liquids aren't always wrapped in plastic bags & I had ordered food item.,Charmain Bausman,2024-12-27
google_play,Amazon Shopping,1,,The app works ok but Amazon service and deliveries keep going downhill fast. Packages are delayed more and more. They often play a switcheroo between search and payment (e.g. the result shows delivery next day but shipping is actually three days). They don't pay their workers enough and rely too much on automation and AI. Prime fees keep going up and you get less and less. It's also very annoying to need to leave the app to purchase a prime video or kindle book.,David Lamb,2025-03-18
google_play,Amazon Shopping,3,,"Let's talk about dumb moves and losing a sale. Stop refreshing recommendations when a user goes back a page. On the homepage I got about 5 great suggested products, clicked into one to look at, hit back, and Amazon shot themselves in the foot. Completely changed them all and I cant find a single recommendation I liked now. Like imagine window shopping and you go back to look in the window again and it's all changed. Well you didn't get that spontaneous sale from me. Thank you!",Michael S,2025-02-24
google_play,Amazon Shopping,1,,"I am mostly switching to Walmart. Amazon doesn't charge my orders right away, which really messes things up. I keep my debit card locked anytime I'm not actively using it. it seems like anytime I order from Amazon, the card gets declined because the order doesn't charge for hours or even days. Walmart charges right away so I'm switching to them until Amazon fixes this. I kept amazon because I could combine crunchyroll and prime video ,but now they're making me watch ads too so I'm canceling.",Chloe Lingenfelter,2024-10-25
google_play,Amazon Shopping,1,,Do you even know how to set up an app? Not only is it the most confusingly platform to use but trying to get help for issues you're experiencing is near impossible unless you like talking to bots that'll talk you in circles. Either wasting your time or frustrating you so much you don't even remember why you're there because of the 50 hoops you had to jump through to finally get someone.,R,2025-01-07
google_play,Amazon Shopping,1,,"This company is awful. They pulled this scam on me. Charged my Prime to a wrong credit card. I asked them to charge the default card. Instead, they marked the charge disputed and cancelled my prime. When I contacted them again to find out what was going on, they said I had to sign up for prime again! They sent a link, I clicked the link, I signed up for Prime again at a huge price increase. Won't keep their word to fix the price, blamed it on me: guess I don't have Prime anymore as they wanted.",Cynthia P,2025-05-29
google_play,Amazon Shopping,1,,"Had to uninstall this app yet again, since Amazon only lets you cancel subscriptions through a web browser, and every time I try to access amazon in a browser on my phone, it just sends me straight back to the app. Amazon knows exactly what they are doing: scamming people out of their money by not allowing them to cancel. The FTC is literally suing them right now for this exact type of fraud. And Internal documents prove Amazon intentionally makes it impossible to cancel to retain customers.",PDX,2024-11-15
google_play,Amazon Shopping,1,,"Amazon used to be a great place to shop. Now it's become overloaded with so much junk, it's difficult to actually find a decent product. Everything is a cheap knock off of a cheap knock off. Reviews are sounding increasingly fake (like AI wrote them) so I don't trust them anymore. Plus, delivery is steadily getting worse, with packages frequently getting lost or delivered to the wrong house entirely. I'm not renewing again. Thumbs down!",Jennifer Phillips,2025-03-22
google_play,Amazon Shopping,1,,"good for delivering parcels. but the worst at account security system. Ever since I ordered the xbox gift card and it didn't work, it really acted up and cause so many security problems. I've reset my password 9 times now. It is ridiculous. I'm doing what I've should have done a long time ago and close down my account, and start a new account or just not make one so I don't have to deal with any of this nightmare!",Sean Lambert,2025-03-24
google_play,Amazon Shopping,1,,"A lot of things just don't work in the app: some listings, I type a question in the search box & click search and nothing happens. I sent a seller 2 messages asking the same question & they never got back to me, so I tried to click ""Report seller"" which shows up in the message, and the button doesn't even work. I also tried to submit feedback for that seller but couldn't do so without already purchasing an item from them first. I would type more but ran out of characters",Sara Oliver,2025-05-15
google_play,Amazon Shopping,1,,"This app used to be fine. It was more convenient to use than going to the website through a browser. Then they added ""Rufus"". Having a pop-up for an AI that I do not want to use forced on me is unacceptable. It only gets in the way. You're supposed to be able to swipe it out of the way, but half the time that doesn't work. If someone stepped in front of people every time they tried to look at something in a real store, that store would go out of business. I got rid of the app because of it.",Lily Elrick,2025-02-14
google_play,Amazon Shopping,4,,"The app has definitely gotten better with the updates, only feedback I have is just about Amazon in general. When you place an order it doesn't charge your card until it ships so I constantly have to remember to check and see if Amazon charged me so I know if it's safe to spend my left over balance. I wish there was a way to choose to either charge my card instantly or charge when it ships.",Ben Neal,2025-02-06
google_play,Amazon Shopping,2,,"I've just been having bad experiences with Amazon, especially lately. Only 1 of the last 5 things I ordered off Amazon showed up so I had to get a refund. my most recent order says problem occurred yet it won't even say what the problem is. it just says problem occurred and it is not deliverable. when things do get delivered it takes a very long time without Prime. also they have odd resellers but at least nothing I've ordered broke. but dang I feel like half of my orders haven't been delivered.",Johnnie Harrison III,2025-08-10
google_play,Amazon Shopping,1,,"I cancelled after 7 out of my last 10 orders were delayed in ""shipping"" after already showing a delivery date of a week for 2 day prime shipping. Amazon turned into a membership website as some products you can't buy without prime or they charge $20+ more if you don't have it. Life has been much easier since I've been shopping with other websites. My only advice to Amazon is to stop promising things you can't deliver on. Why would I pay $180/year for a service I'm not getting?",Kousuke Kanzaki,2025-07-12
google_play,Amazon Shopping,5,,"I love the Amazon shopping app! Amazon makes it easy to search and find what you're looking for, and there are so many great options to choose from. I also like the wishlist and save for later features so you can keep an eye on items you might want in the future. You can also get select items overnight, which is amazing and has come in handy so many times. Highly recommend!",Cassandra Perez,2025-05-03
google_play,Amazon Shopping,1,,"Amazon is now home to the worst customer service and the worst implementation of AI I've ever experienced. Their help and support is basically non-existent at this point. It's just their terrible AI assistant that does nothing but redirect you endlessly to pages you've already been to. I've had issues with packages being stolen, delivery drivers not following delivery instructions, and other technical issues with both the app and website. I might just be done buying from Amazon. I'm serious.",Aaron Orel,2025-05-30
google_play,Amazon Shopping,3,,"I like the variety and easy checkout process, but even paying for prime delivery is slow. Sometimes the tracking information shows it was delivered to someone in another state, and trying to get a refund/replacement is a huge pain. They just sent yet another package to the other side of the country, and now I don't have items I need for work nor can I afford to repurchase them.",Kai Nazgul,2025-03-19
google_play,Amazon Shopping,4,,It's a good app for shopping and getting what I need fast. The only real complaint I have is they removed the save for later feature and I had stuff in there I planned to buy when I had the money. they say we'll just use lists but the thing is with saved for later it was visible so.i could see it and if I wanted to buy it or had the money then I just moved it and got it. where as list are out of sight out of mind and I'll forget all about it.,Donald Paul,2025-05-13
